{"$schema":"../../schemas/SCHEMA-000013-workflow.json","id":"AIOS-WORKFLOW-000008","name":"optimize","version":"1.0.0","description":"Performance optimization: profile -> analyze (perf engine) -> plan -> implement -> validate.","triggers":["hoa optimize","hoa profile"],"lifecycle":[{"phase":"profile","order":1,"engine":"AIOS-MODULE-000025"},{"phase":"plan","order":2,"engine":"AIOS-MODULE-000004"},{"phase":"implement","order":3,"engine":"AIOS-MODULE-000009"},{"phase":"validate","order":4,"engine":"AIOS-MODULE-000010"}],"estimated_duration":{"min_minutes":5,"max_minutes":30}}