{"$schema": "../../schemas/SCHEMA-000013-workflow.json", "id": "AIOS-WORKFLOW-000003", "name": "audit-project", "version": "1.0.0", "description": "Full project audit: architecture score, security scan, compliance check, vuln report.", "triggers": ["hoa audit"], "lifecycle": [{"phase": "analyze", "order": 1, "engine": "AIOS-MODULE-000007"}, {"phase": "security", "order": 2, "engine": "AIOS-MODULE-000012"}, {"phase": "review", "order": 3, "engine": "AIOS-MODULE-000011"}]}