{"$schema": "../../schemas/SCHEMA-000013-workflow.json", "id": "AIOS-WORKFLOW-000001", "name": "build-feature", "version": "1.0.0", "description": "Full feature lifecycle: spec -> plan -> code -> test -> review -> deploy.", "triggers": ["hoa build feature", "hoa feature"], "lifecycle": [{"phase": "understand", "order": 1, "engine": "AIOS-MODULE-000002"}, {"phase": "analyze", "order": 2, "engine": "AIOS-MODULE-000007"}, {"phase": "plan", "order": 3, "engine": "AIOS-MODULE-000004"}, {"phase": "implement", "order": 4, "engine": "AIOS-MODULE-000009"}, {"phase": "validate", "order": 5, "engine": "AIOS-MODULE-000010"}, {"phase": "review", "order": 6, "engine": "AIOS-MODULE-000011"}], "rollback_workflow": "AIOS-WORKFLOW-000002"}