{"$schema":"../../schemas/SCHEMA-000013-workflow.json","id":"AIOS-WORKFLOW-000010","name":"release","version":"1.0.0","description":"Full release pipeline: validate -> test -> review -> document -> deploy -> release-notes.","triggers":["hoa release","hoa deploy"],"lifecycle":[{"phase":"validate","order":1,"gate":"tests_pass","engine":"AIOS-MODULE-000010"},{"phase":"review","order":2,"gate":"review_approved","engine":"AIOS-MODULE-000011"},{"phase":"document","order":3,"engine":"AIOS-MODULE-000026"},{"phase":"deploy","order":4,"engine":"AIOS-MODULE-000013"},{"phase":"release-notes","order":5,"engine":"AIOS-MODULE-000026"}],"rollback_workflow":"AIOS-WORKFLOW-000002","estimated_duration":{"min_minutes":10,"max_minutes":45}}