{"$schema":"../../schemas/SCHEMA-000013-workflow.json","id":"AIOS-WORKFLOW-000007","name":"upgrade","version":"1.0.0","description":"Dependency upgrade with impact analysis: analyze deps -> plan migration -> implement -> validate -> document breaking changes.","triggers":["hoa upgrade","hoa upgrade <package>"],"lifecycle":[{"phase":"analyze-deps","order":1,"engine":"AIOS-MODULE-000005"},{"phase":"plan","order":2,"engine":"AIOS-MODULE-000004"},{"phase":"implement","order":3,"engine":"AIOS-MODULE-000009"},{"phase":"validate","order":4,"engine":"AIOS-MODULE-000010"},{"phase":"document","order":5,"engine":"AIOS-MODULE-000026"}],"rollback_workflow":"AIOS-WORKFLOW-000002","estimated_duration":{"min_minutes":15,"max_minutes":60}}