{"$schema":"../../schemas/SCHEMA-000013-workflow.json","id":"AIOS-WORKFLOW-000005","name":"review-code","version":"1.0.0","description":"Code review pipeline: analyze -> security scan -> code review -> report.","triggers":["hoa review","hoa review <path>"],"lifecycle":[{"phase":"analyze","order":1,"engine":"AIOS-MODULE-000007"},{"phase":"security","order":2,"engine":"AIOS-MODULE-000012"},{"phase":"review","order":3,"engine":"AIOS-MODULE-000011"},{"phase":"report","order":4,"engine":"AIOS-MODULE-000026"}],"estimated_duration":{"min_minutes":2,"max_minutes":15}}