{"$schema":"../../schemas/SCHEMA-000013-workflow.json","id":"AIOS-WORKFLOW-000009","name":"analyze","version":"1.0.0","description":"Comprehensive project analysis: architecture -> security -> performance -> review -> report.","triggers":["hoa analyze","hoa audit"],"lifecycle":[{"phase":"architecture","order":1,"engine":"AIOS-MODULE-000007"},{"phase":"security","order":2,"engine":"AIOS-MODULE-000012"},{"phase":"performance","order":3,"engine":"AIOS-MODULE-000025"},{"phase":"review","order":4,"engine":"AIOS-MODULE-000011"},{"phase":"report","order":5,"engine":"AIOS-MODULE-000026"}],"estimated_duration":{"min_minutes":3,"max_minutes":20}}