{"$schema":"../../schemas/SCHEMA-000013-workflow.json","id":"AIOS-WORKFLOW-000006","name":"refactor","version":"1.0.0","description":"Safe refactoring with rollback: analyze -> plan -> implement -> validate -> review -> document.","triggers":["hoa refactor","hoa refactor <path>"],"lifecycle":[{"phase":"analyze","order":1,"engine":"AIOS-MODULE-000007"},{"phase":"plan","order":2,"engine":"AIOS-MODULE-000004"},{"phase":"implement","order":3,"engine":"AIOS-MODULE-000009"},{"phase":"validate","order":4,"engine":"AIOS-MODULE-000010"},{"phase":"review","order":5,"engine":"AIOS-MODULE-000011"},{"phase":"document","order":6,"engine":"AIOS-MODULE-000026"}],"rollback_workflow":"AIOS-WORKFLOW-000002","estimated_duration":{"min_minutes":10,"max_minutes":60}}