{"$schema":"../../schemas/SCHEMA-000013-workflow.json","id":"AIOS-WORKFLOW-000004","name":"fix-bug","version":"1.0.0","description":"Full bug fix lifecycle: understand -> analyze (bug engine) -> plan -> implement -> validate -> review.","triggers":["hoa fix bug","hoa debug","hoa fix <bug-id>"],"lifecycle":[{"phase":"understand","order":1,"engine":"AIOS-MODULE-000002"},{"phase":"analyze","order":2,"engine":"AIOS-MODULE-000024"},{"phase":"plan","order":3,"engine":"AIOS-MODULE-000004"},{"phase":"implement","order":4,"engine":"AIOS-MODULE-000009"},{"phase":"validate","order":5,"engine":"AIOS-MODULE-000010"},{"phase":"review","order":6,"engine":"AIOS-MODULE-000011"}],"rollback_workflow":"AIOS-WORKFLOW-000002","estimated_duration":{"min_minutes":5,"max_minutes":30}}